{
  "tool_id": "last9-mcp-server",
  "version": "0.5.1",
  "grade": "B",
  "risk_score": 16,
  "scan_date": "2026-03-02T17:13:32.271067384Z",
  "scanner": "ToolTrust Scanner/0.1.2",
  "source_url": "https://github.com/last9/last9-mcp-server",
  "category": "Developer Tools",
  "vendor": "last9",
  "stars": 50,
  "license": "Apache-2.0",
  "language": "Go",
  "description": "Last9 MCP Server",
  "findings": [
    {
      "id": "AS-004",
      "severity": "Medium",
      "title": "Supply Chain CVE: GO-2026-4440 in golang.org/x/net@0.43.0",
      "description": "GO-2026-4440 in golang.org/x/net@0.43.0 (Go ecosystem).",
      "recommendation": "Upgrade golang.org/x/net to a version that resolves GO-2026-4440. Check https://osv.dev/vulnerability/GO-2026-4440 for patched versions. Enable Dependabot or OSV-Scanner in CI to catch future CVEs automatically."
    },
    {
      "id": "AS-004",
      "severity": "Medium",
      "title": "Supply Chain CVE: GO-2026-4441 in golang.org/x/net@0.43.0",
      "description": "GO-2026-4441 in golang.org/x/net@0.43.0 (Go ecosystem).",
      "recommendation": "Upgrade golang.org/x/net to a version that resolves GO-2026-4441. Check https://osv.dev/vulnerability/GO-2026-4441 for patched versions. Enable Dependabot or OSV-Scanner in CI to catch future CVEs automatically."
    }
  ],
  "summary": {
    "critical": 0,
    "high": 0,
    "medium": 2,
    "low": 0,
    "info": 0
  },
  "methodology": "https://github.com/AgentSafe-AI/tooltrust-directory/blob/main/docs/methodology.md"
}